{
	"$schema": "../schemas/location.schema.json",
	"id": "church_light",
	"name": "The Church of Light",
	"default_scene": "nave",
	"scenes": [
		{
			"id": "nave",
			"name": "The Nave",
			"variants": [
				{
					"requirements": [],
					"description": "Echoes of old chants and heroic memories resonate through the opulent halls.",
					"art": "church.txt"
				}
			],
			"options": [],
			"connections": [
				{
					"label": "Return to the street.",
					"destination_location": "street",
					"destination_scene": ""
				}
			]
		}
	]
}
