{
	"$schema": "../schemas/location.schema.json",
	"id": "askas_rest",
	"name": "Aska's Rest",
	"default_scene": "common_room",
	"scenes": [
		{
			"id": "common_room",
			"name": "Common Room",
			"variants": [
				{
					"requirements": [],
					"description": "A cozy fire crackles in a hearth at the far side of the room.",
					"art": "pint.txt"
				}
			],
			"options": [],
			"connections": [
				{
					"label": "Leave the tavern.",
					"destination_location": "street",
					"destination_scene": ""
				}
			]
		}
	]
}
